{
  "meta": {
    "version": "2.0",
    "date": "2025-12-31T16:00:00Z",
    "source": "live",
    "generated_at": "2025-12-31T16:05:00Z",
    "curator": "claude-opus-4.5"
  },
  "vibe": "New Year's Eve and the AI keeps on shipping",
  "highlights": [
    "JSON-first architecture lands",
    "Historical backfill now possible"
  ],
  "stories": [
    {
      "id": 46500001,
      "title": "Claude Reads HN goes JSON-first",
      "url": "https://github.com/thevibeworks/claude-reads-hn",
      "hn_url": "https://news.ycombinator.com/item?id=46500001",
      "points": 420,
      "comments_count": 69,
      "by": "thevibeworks",
      "time": "2025-12-31T15:00:00Z",
      "content": {
        "tldr": "The HN digest system now uses JSON as source of truth. Org and HTML are derived artifacts. Translations can be added independently.",
        "take": "Finally, a data format that doesn't require regex wizardry to parse. The org-mode era is over, long live structured data.",
        "comments": [
          {"by": "json_enjoyer", "text": "Should have been JSON from day one.", "id": 46500101},
          {"by": "org_defender", "text": "But emacs integration...", "id": 46500102}
        ]
      },
      "tags": ["meta", "architecture", "json"],
      "i18n": {}
    },
    {
      "id": 46500002,
      "title": "Historical HN Backfill via Algolia",
      "url": "https://hn.algolia.com/api",
      "hn_url": "https://news.ycombinator.com/item?id=46500002",
      "points": 315,
      "comments_count": 42,
      "by": "algolia_fan",
      "time": "2025-12-31T14:30:00Z",
      "content": {
        "tldr": "You can now generate historical digests for any week in 2025 using Algolia's HN search API. Just point the backfill agent at a date range.",
        "take": "2025 in review, curated by AI. This is either peak productivity or peak navel-gazing. Probably both.",
        "comments": [
          {"by": "historian", "text": "Finally can see what mattered in January.", "id": 46500201}
        ]
      },
      "tags": ["api", "backfill", "history"],
      "i18n": {}
    }
  ]
}
